{
  "SOURCE_SYSTEM": "legacy_site",
  "TARGET_SCHEMA_VERSION": "schema-v1",
  "MEDIA_DIR": "./legacy-export/media",
  "BUNDLE_FILE": "./dist/migration-bundle.oci",
  "BUNDLE_REF_FILE": "./dist/migration-bundle.digest-ref.txt",
  "OCI_REF_TAG": "registry.example.com/underlay/site-migration:demo-20260302",
  "GOVERNANCE_POLICY_FILE": "./runtime/governance-policy.json",
  "REUSE_FROM_DIGEST_REF_FILE": "./dist/migration-bundle.digest-ref.txt",
  "UNDERLAY_DEVTOOLS_CMD": "underlay-devtools",
  "APP_MIGRATION_RUNNER_CMD": "cargo run -p myapp-migration -- run",
  "PROJECT_NAME": "acowtancy",
  "DRIFT_MAX_UNRESOLVED": "0",
  "DRIFT_MAX_GOVERNANCE": "0",
  "DRIFT_MAX_LINEAGE": "0"
}
